{
  "id": "ledger_01JAV3QK2M0000000000000001",
  "schema_version": "nodes.culture.dev/ledger/v1alpha1",
  "record_type": "claim",
  "run_id": "run_01JAV3QK2M0000000000000001",
  "node_run_id": "nr_01JAV3QK2M0000000000000007",
  "attempt_id": "att_01JAV3QK2M0000000000000009",
  "origin": {
    "kind": "agent",
    "actor_id": "actor_planner_v3",
    "actor_revision": "planner-2026-07-11"
  },
  "authority": "proposed",
  "subject_ref": "task_01JAV3QK2M0000000000000004",
  "data": {
    "statement": "The change-set applies cleanly to the pinned workspace.",
    "kind": "completion",
    "rationale": "Agent-reported. Not evidence: an agent saying it is done is a completion claim."
  },
  "provenance_refs": [],
  "supersedes": null,
  "created_at": "2026-08-08T15:00:00Z",
  "content_digest": "sha256:9615a8946bdad6740751c9a2fe5b2dd0720a6794b5891dd6ab5c023a46406d87"
}
